{
  "schema_version": 1,
  "status": "passed",
  "checks": [
    {
      "check_id": "QUAL-SIM-001",
      "module": "dv_qualification",
      "kind": "simulation",
      "status": "passed",
      "message": "Arithmetic and event scheduling fixture completed"
    }
  ],
  "artifacts": [],
  "diagnostics": []
}
